<?xml version="1.0" encoding="UTF-8" standalone="yes"?>

<plotModel xmlns:xsi="http://www.w3.org/2001/XMLSchema-instance"
           xsi:noNamespaceSchemaLocation="plotModel.xsd"
        plugin="airep" name="standard"       
        svgTemplate="standardPlotModelTemplate.svg">
		
		<!--  This was created from nmap full_standard plot model for ACFT
		 but some params have been commented out since  all the parameters
		 have not been implemented yet for airep 
		 
		  -->
<!--        <PlotModelElement symbolSize="1" textStyle="Bold" 
textFont="Courier" textSize="14" paramName="TMPC">
            <Position>UL</Position>
            <Color red="255" green="0" blue="0"/>
        </PlotModelElement> -->
        <!-- 
        <PlotModelElement symbolSize="1" textStyle="Bold" 
textFont="Courier" textSize="14" paramName="BRBK">
            <Position>MC</Position>
            <Color red="0" green="255" blue="255"/>
        </PlotModelElement>
         -->                
        <PlotModelElement symbolSize="1" textStyle="Bold" 
textFont="Courier" textSize="14" paramName="TPOI">
            <Position>UC</Position>
            <Color red="255" green="255" blue="0"/>
        </PlotModelElement>  
        
        <PlotModelElement symbolSize="1" textStyle="Bold" 
textFont="Courier" textSize="14" paramName="ICSY">
            <Position>UR</Position>
            <Color red="255" green="0" blue="255"/>
        </PlotModelElement>  
        <PlotModelElement symbolSize="1" textStyle="Bold" 
textFont="Courier" textSize="14" paramName="STID">
            <Position>MC</Position>
            <Color red="205" green="133" blue="0"/>
        </PlotModelElement>
        <PlotModelElement symbolSize="1" textStyle="Bold" 
textFont="Courier" textSize="14" paramName="FELV">
            <Position>LC</Position>
            <Color red="0" green="255" blue="0"/>
        </PlotModelElement>
        <PlotModelElement symbolSize="1" textStyle="Bold" 
textFont="Courier" textSize="14" paramName="TBSY">
            <Position>UL</Position>
            <Color red="0" green="178" blue="238"/>
        </PlotModelElement>   
        <!-- <PlotModelElement symbolSize="1" textStyle="Bold" 
textFont="Courier" textSize="14" paramName="CLC1">
            <Position>TC</Position>
            <Color red="0" green="178" blue="238"/>
        </PlotModelElement>     -->  
</plotModel>
